{
  "asks": [
    {
      "command": "./z0 onboard --accept toolchains   (or --yes for every bundle)",
      "consent": "C1",
      "id": "toolchain.bun",
      "impact": 29,
      "reason": "user-local download of bun 1.4.3 into $Z0_HOME/toolchains (needs consent: toolchains bundle)"
    },
    {
      "command": "./z0 onboard --accept toolchains   (or --yes for every bundle)",
      "consent": "C1",
      "id": "toolchain.node",
      "impact": 12,
      "reason": "user-local download of node 22.23.4 into $Z0_HOME/toolchains (needs consent: toolchains bundle)"
    },
    {
      "command": "tailscale up, then re-run ./z0 onboard",
      "consent": "C2",
      "id": "dash.bridge.unit",
      "impact": 3,
      "reason": "no tailnet IPv4 on this host (C2)"
    },
    {
      "command": "manual: link .verified-oss-loop/skills into your harness skill dir",
      "consent": "C2",
      "id": "z0evals.ask.kit_skills",
      "impact": 1,
      "reason": "manual step, never automatic (C2)"
    },
    {
      "command": "manual: visual-parity probes (web/docs/probes) need a Chromium path and websockets",
      "consent": "C2",
      "id": "z0evals.ask.visual_probes",
      "impact": 1,
      "reason": "manual step, never automatic (C2)"
    }
  ],
  "components": {
    "dash": {
      "adopted": false,
      "tree": "$Z0_HOME/repos/dash",
      "verdict": "allow"
    },
    "oh-my-pi": {
      "adopted": false,
      "tree": "$Z0_HOME/repos/oh-my-pi",
      "verdict": "allow"
    },
    "tokenomics": {
      "adopted": false,
      "tree": "$Z0_HOME/repos/tokenomics",
      "verdict": "allow"
    },
    "z0evals": {
      "adopted": false,
      "tree": "$Z0_HOME/repos/z0evals",
      "verdict": "allow"
    }
  },
  "grants": {
    "bundles": [],
    "source": "none"
  },
  "host_id": "9a8b7c6d5e4f3021",
  "llm": "local",
  "mode": "auto",
  "pin_policy": "pinned",
  "plan_hash": "879ee49309f91bc1f01115ffce31bdb96b60793584d0ee7752f075c683f4e118",
  "prepared_path": [
    "/usr/bin",
    "/bin"
  ],
  "profile": "core",
  "registry": {
    "registry/components.yaml": "197817366d3b52169cddff78d94819664a68b03f3eac68ea4a8c2ca45aaff6ed",
    "registry/harnesses.yaml": "1c2b9ba37ca974e4aa1ed1f6990561ea303fc7e1f73c0fb4c6cc4802d5b4a7b8",
    "registry/onboarding.yaml": "b0c3e2b4c8e7a17bde8a5cb2378c90f6009b4464879a76406f6ae3cdc7e9b9ce",
    "registry/profiles.yaml": "1078cbeef86e532c77478eb5025ec08f6f3f8156a1c77707774416e79d51f819",
    "registry/toolchains.yaml": "10255da4b970f08ef57b4e9fd68b7dedfbc5f43bde284a35caecac4bcd0213b1"
  },
  "steps": [
    {
      "state": {
        "status": "todo"
      },
      "step": {
        "argv": [
          "scripts/registry-check"
        ],
        "component": "z0",
        "consent": {
          "class": "C0"
        },
        "env": {
          "PATH": "$Z0_HOME/venv/bin:/usr/bin:/bin"
        },
        "id": "z0.registry_check",
        "kind": "check"
      }
    },
    {
      "state": {
        "status": "todo"
      },
      "step": {
        "argv": [
          "./z0",
          "onboard",
          "plan",
          "--stdout",
          "--check-deterministic"
        ],
        "component": "z0",
        "consent": {
          "class": "C0"
        },
        "env": {
          "PATH": "$Z0_HOME/venv/bin:/usr/bin:/bin"
        },
        "id": "z0.plan_deterministic",
        "kind": "check"
      }
    },
    {
      "state": {
        "status": "todo"
      },
      "step": {
        "argv": [
          "./z0",
          "init",
          "--profile",
          "core",
          "--dry-run"
        ],
        "component": "z0",
        "consent": {
          "class": "C0"
        },
        "env": {
          "PATH": "$Z0_HOME/venv/bin:/usr/bin:/bin"
        },
        "id": "z0.init_dry_run",
        "kind": "check"
      }
    },
    {
      "state": {
        "reason": "c1_ungranted",
        "status": "ask"
      },
      "step": {
        "component": "z0",
        "consent": {
          "bundle": "toolchains",
          "class": "C1"
        },
        "creates": [
          "$Z0_HOME/toolchains/bun/1.4.3"
        ],
        "id": "toolchain.bun",
        "kind": "ensure_toolchain",
        "network": true,
        "toolchain": {
          "tool": "bun",
          "version": "1.4.3"
        },
        "undo": {
          "kind": "remove_owned"
        }
      }
    },
    {
      "state": {
        "status": "already_satisfied"
      },
      "step": {
        "component": "z0",
        "consent": {
          "class": "C0"
        },
        "id": "toolchain.git",
        "kind": "ensure_toolchain",
        "toolchain": {
          "tool": "git",
          "version": "system"
        }
      }
    },
    {
      "state": {
        "reason": "c1_ungranted",
        "status": "ask"
      },
      "step": {
        "component": "z0",
        "consent": {
          "bundle": "toolchains",
          "class": "C1"
        },
        "creates": [
          "$Z0_HOME/toolchains/node/22.23.4"
        ],
        "id": "toolchain.node",
        "kind": "ensure_toolchain",
        "network": true,
        "toolchain": {
          "tool": "node",
          "version": "22.23.4"
        },
        "undo": {
          "kind": "remove_owned"
        }
      }
    },
    {
      "state": {
        "status": "already_satisfied"
      },
      "step": {
        "component": "z0",
        "consent": {
          "bundle": "toolchains",
          "class": "C1"
        },
        "id": "toolchain.python3",
        "kind": "ensure_toolchain",
        "network": true,
        "toolchain": {
          "tool": "python",
          "version": "3.12"
        }
      }
    },
    {
      "state": {
        "blocked_by": "toolchain.node",
        "reason": "dependency",
        "status": "blocked"
      },
      "step": {
        "component": "tokenomics",
        "consent": {
          "class": "C0"
        },
        "id": "tokenomics.source",
        "kind": "adopt_or_clone",
        "network": true,
        "probe": {
          "exists": "$Z0_HOME/repos/tokenomics"
        },
        "where": "mirror"
      }
    },
    {
      "state": {
        "blocked_by": "tokenomics.source",
        "reason": "dependency",
        "status": "blocked"
      },
      "step": {
        "component": "tokenomics",
        "consent": {
          "class": "C0"
        },
        "creates": [
          "$Z0_HOME/venvs/tokenomics"
        ],
        "id": "tokenomics.venv",
        "kind": "venv",
        "needs": [
          "tokenomics.source"
        ],
        "probe": {
          "exists": "$Z0_HOME/venvs/tokenomics/bin/python"
        },
        "undo": {
          "kind": "remove_owned"
        },
        "where": "venv"
      }
    },
    {
      "state": {
        "blocked_by": "tokenomics.venv",
        "reason": "dependency",
        "status": "blocked"
      },
      "step": {
        "argv": [
          "pip",
          "install",
          "-e",
          "packages/python"
        ],
        "component": "tokenomics",
        "consent": {
          "class": "C0"
        },
        "id": "tokenomics.install.python",
        "kind": "pip_install",
        "legacy_projection": true,
        "needs": [
          "tokenomics.venv"
        ],
        "network": true,
        "probe": {
          "exists": "$Z0_HOME/venvs/tokenomics/bin/tokenomics"
        },
        "where": "venv"
      }
    },
    {
      "state": {
        "blocked_by": "tokenomics.source",
        "reason": "dependency",
        "status": "blocked"
      },
      "step": {
        "argv": [
          "npm",
          "install",
          "-w",
          "packages/typescript"
        ],
        "component": "tokenomics",
        "consent": {
          "class": "C0"
        },
        "creates": [
          "$Z0_HOME/repos/tokenomics/node_modules"
        ],
        "id": "tokenomics.install.npm",
        "kind": "run",
        "legacy_projection": true,
        "needs": [
          "tokenomics.source"
        ],
        "network": true,
        "timeout_s": 1800,
        "where": "build"
      }
    },
    {
      "state": {
        "blocked_by": "tokenomics.install.python",
        "reason": "dependency",
        "status": "blocked"
      },
      "step": {
        "argv": [
          "tokenomics",
          "report",
          "--range",
          "today"
        ],
        "component": "tokenomics",
        "consent": {
          "class": "C0"
        },
        "id": "tokenomics.verify",
        "kind": "check",
        "legacy_projection": true,
        "needs": [
          "tokenomics.install.python"
        ],
        "where": "venv"
      }
    },
    {
      "state": {
        "blocked_by": "toolchain.bun",
        "reason": "dependency",
        "status": "blocked"
      },
      "step": {
        "component": "oh-my-pi",
        "consent": {
          "class": "C0"
        },
        "id": "oh-my-pi.source",
        "kind": "adopt_or_clone",
        "network": true,
        "probe": {
          "exists": "$Z0_HOME/repos/oh-my-pi"
        },
        "where": "mirror"
      }
    },
    {
      "state": {
        "blocked_by": "oh-my-pi.source",
        "reason": "dependency",
        "status": "blocked"
      },
      "step": {
        "argv": [
          "bun",
          "install"
        ],
        "component": "oh-my-pi",
        "consent": {
          "class": "C0"
        },
        "creates": [
          "$Z0_HOME/repos/oh-my-pi/node_modules"
        ],
        "id": "oh-my-pi.install",
        "kind": "run",
        "legacy_projection": true,
        "needs": [
          "oh-my-pi.source"
        ],
        "network": true,
        "timeout_s": 1800,
        "where": "build"
      }
    },
    {
      "state": {
        "blocked_by": "oh-my-pi.install",
        "reason": "dependency",
        "status": "blocked"
      },
      "step": {
        "argv": [
          "bun",
          "run",
          "build"